{
  "$schema": "http://json-schema.org/draft-07/schema#",
  "$id": "us_short_action_governance",
  "title": "US-short §9 action layer governance — const-pins the final_action→price one-to-one map (§9/§6.1, '避免状态/价位脱钩'), the 5-group 保命优先 action_rank skeleton, and the observe_reason_type vocab",
  "description": "Batch-1 declarative governance contract. Freezes the §9 final_action→price-field correspondence the design explicitly locks to avoid state/price decoupling (建仓/加仓→entry; 减仓→take_profit_reduce_price; 清仓-止损→stop_clear_price; 清仓-止盈→take_profit_exit_price; 清仓-事件→event_clear_reference_price; 持有/观察/否决-避开→none), the §6.1 holding-exit price field meanings, the §9 survival-first 5-group action_rank skeleton (grouping NOT weighting), and the §9 observe_reason_type vocab. So batch-2 (engine) and batch-3 (renderer/validator) cannot couple an action to the wrong price level or reorder the survival-first skeleton. draft-07 cannot express: byte-faithfulness to §9/§6.1, final_action == action_table == converter TRADE_ACTIONS, sell price targets ⊆ holding-exit fields ⊆ action_table columns, observe_reason_type == action_table — enforced in tests.",
  "type": "object",
  "additionalProperties": false,
  "required": [
    "schema_name",
    "schema_version",
    "as_of",
    "status",
    "final_action_price_map",
    "holding_exit_price_fields",
    "action_rank_skeleton",
    "observe_reason_types",
    "action_rank_policy",
    "notes"
  ],
  "properties": {
    "schema_name": {
      "const": "us_short_action_governance"
    },
    "schema_version": {
      "type": "string",
      "pattern": "^[0-9]+\\.[0-9]+\\.[0-9]+$"
    },
    "as_of": {
      "type": "string",
      "pattern": "^[0-9]{8}$"
    },
    "status": {
      "type": "string",
      "minLength": 1
    },
    "final_action_price_map": {
      "description": "§9 final_action 词表 — one-to-one with §6.1 price levels. price_target = the holding-exit field, 'entry' (建仓/加仓 entry-price complex), or null; carries_observe_reason true only for 观察.",
      "const": [
        {
          "final_action": "建仓",
          "price_target": "entry",
          "carries_observe_reason": false
        },
        {
          "final_action": "加仓",
          "price_target": "entry",
          "carries_observe_reason": false
        },
        {
          "final_action": "减仓",
          "price_target": "take_profit_reduce_price",
          "carries_observe_reason": false
        },
        {
          "final_action": "清仓-止损",
          "price_target": "stop_clear_price",
          "carries_observe_reason": false
        },
        {
          "final_action": "清仓-止盈",
          "price_target": "take_profit_exit_price",
          "carries_observe_reason": false
        },
        {
          "final_action": "清仓-事件",
          "price_target": "event_clear_reference_price",
          "carries_observe_reason": false
        },
        {
          "final_action": "持有",
          "price_target": null,
          "carries_observe_reason": false
        },
        {
          "final_action": "观察",
          "price_target": null,
          "carries_observe_reason": true
        },
        {
          "final_action": "否决/避开",
          "price_target": null,
          "carries_observe_reason": false
        }
      ]
    },
    "holding_exit_price_fields": {
      "description": "§6.1 holding_exit_engine passive levels {field, meaning}, byte-faithful.",
      "const": [
        {
          "field": "stop_clear_price",
          "meaning": "止损清仓价"
        },
        {
          "field": "take_profit_reduce_price",
          "meaning": "盈一减仓价"
        },
        {
          "field": "take_profit_exit_price",
          "meaning": "盈二/跟踪止盈价"
        },
        {
          "field": "event_clear_reference_price",
          "meaning": "事件硬风险清仓参考价，标\"人工执行、非技术价\""
        }
      ]
    },
    "action_rank_skeleton": {
      "description": "§9 5 组骨架（保命优先）— ordered groups; ORDER is the survival-first priority, const-pinned.",
      "const": [
        {
          "group": 1,
          "label": "持仓强制减/清（触发止损或 position veto）"
        },
        {
          "group": 2,
          "label": "可建仓新机会（过闸+可操作+触发/临近，按选股排名）"
        },
        {
          "group": 3,
          "label": "加仓"
        },
        {
          "group": 4,
          "label": "持有/观察"
        },
        {
          "group": 5,
          "label": "否决/放弃"
        }
      ]
    },
    "observe_reason_types": {
      "description": "§9 observe_reason_type vocab (observe must split reason; == action_table observe_reason_type).",
      "const": [
        "signal_not_ready",
        "price_not_executable",
        "cash_or_account_missing",
        "risk_cooldown",
        "data_restricted",
        "event_window",
        "cost_inefficient_min_size",
        "capacity_or_budget_deferred"
      ]
    },
    "action_rank_policy": {
      "description": "§9 governing rules: grouping not weighting (防把必须止损的持仓排到新买点后) + survival-first.",
      "type": "object",
      "additionalProperties": false,
      "required": [
        "grouping_not_weighting",
        "survival_first"
      ],
      "properties": {
        "grouping_not_weighting": {
          "const": true
        },
        "survival_first": {
          "const": true
        }
      }
    },
    "notes": {
      "type": "object"
    }
  }
}
